[
  {
    "schemaVersion": 1,
    "id": "context.architecture.delivery-planes",
    "recordType": "ARCHITECTURE_DECISION",
    "title": "Separate control, execution, context, and validation planes",
    "content": "The delivery workflow keeps authorization and state in the Control Plane, bounded tools in the Execution Plane, selected records in the Context Plane, and tested-commit evidence in the Validation Plane.",
    "source": {
      "type": "DOCUMENTATION",
      "classification": "PUBLIC",
      "reference": "repo://docs/adr/agent-control-plane-scope.md",
      "sourceCommit": "cd86f65ceb0bd1b668324e7d523d5a49568461c7"
    },
    "sensitivity": "PUBLIC",
    "allowedStages": ["spec", "plan", "targets", "implement", "verify", "review"],
    "allowedPersonas": ["synthetic-implementer", "synthetic-code-reviewer", "synthetic-validator"],
    "allowedAgents": [
      "agent.intake",
      "agent.specification",
      "agent.planning",
      "agent.change-target",
      "agent.implementation",
      "agent.verification",
      "agent.review-assistant"
    ],
    "requiredScopes": ["artifact:read"],
    "priority": 100,
    "createdAt": "2026-07-15T12:00:00.000Z",
    "updatedAt": "2026-07-17T00:00:00.000Z",
    "freshnessPolicy": { "mode": "NEVER_EXPIRES" },
    "state": "ACTIVE",
    "tags": ["architecture", "governance"],
    "citations": [
      {
        "label": "Public architecture decision",
        "reference": "repo://docs/adr/agent-control-plane-scope.md"
      }
    ],
    "contentHash": "f40965166f5fd4b45875f7d4e3da61663d30e3f5c45b9d734122599024420cf7"
  },
  {
    "schemaVersion": 1,
    "id": "context.domain.human-approval",
    "recordType": "DOMAIN_RULE",
    "title": "AI output cannot approve its own delivery transition",
    "content": "Implementation authors cannot approve their own diff. Release readiness requires a distinct authorized validator, and ordinary branch and pull-request controls remain authoritative.",
    "source": {
      "type": "DOCUMENTATION",
      "classification": "PUBLIC",
      "reference": "repo://docs/authorization-and-separation-of-duties.md",
      "sourceCommit": "cd86f65ceb0bd1b668324e7d523d5a49568461c7"
    },
    "sensitivity": "PUBLIC",
    "allowedStages": ["intake", "spec", "plan", "targets", "implement", "verify", "review"],
    "allowedPersonas": ["synthetic-implementer", "synthetic-code-reviewer", "synthetic-validator"],
    "allowedAgents": [
      "agent.intake",
      "agent.specification",
      "agent.planning",
      "agent.change-target",
      "agent.implementation",
      "agent.verification",
      "agent.review-assistant"
    ],
    "requiredScopes": ["artifact:read"],
    "priority": 98,
    "createdAt": "2026-07-15T12:00:00.000Z",
    "updatedAt": "2026-07-17T00:00:00.000Z",
    "freshnessPolicy": { "mode": "NEVER_EXPIRES" },
    "state": "ACTIVE",
    "tags": ["domain", "governance", "review"],
    "contentHash": "6f7345d5c5d288c6b337edb10c3af02c9b3c6162855708926188c72e94ffc7a4"
  },
  {
    "schemaVersion": 1,
    "id": "context.engineering.semantic-controls",
    "recordType": "ENGINEERING_CONVENTION",
    "title": "Prefer semantic controls and deterministic local behavior",
    "content": "Use native buttons, links, inputs, and disclosures; keep enabled browser actions functional; label provider-shaped operations simulated; and attach local evidence to deterministic inputs.",
    "source": {
      "type": "REPOSITORY",
      "classification": "PUBLIC",
      "reference": "repo://AGENTS.md",
      "sourceCommit": "cd86f65ceb0bd1b668324e7d523d5a49568461c7"
    },
    "sensitivity": "PUBLIC",
    "allowedStages": ["spec", "plan", "targets", "implement", "verify", "review"],
    "allowedPersonas": ["synthetic-implementer", "synthetic-code-reviewer", "synthetic-validator"],
    "allowedAgents": [
      "agent.intake",
      "agent.specification",
      "agent.planning",
      "agent.change-target",
      "agent.implementation",
      "agent.verification",
      "agent.review-assistant"
    ],
    "requiredScopes": ["artifact:read"],
    "priority": 92,
    "createdAt": "2026-07-15T12:00:00.000Z",
    "updatedAt": "2026-07-17T00:00:00.000Z",
    "freshnessPolicy": { "mode": "TTL", "ttlSeconds": 604800 },
    "state": "ACTIVE",
    "tags": ["engineering", "testing", "review"],
    "contentHash": "1fabd6ca3e327326dcc4663d5fe8ceede3fa26bb8d0627c3e30358f3f4b48610"
  },
  {
    "schemaVersion": 1,
    "id": "context.prior.failure.zero-budget",
    "recordType": "PRIOR_FAILURE",
    "title": "Prior synthetic failure: zero-budget variance",
    "content": "A prior synthetic run failed when percentage variance divided by a zero budget. The record is eligible only under an episodic-memory policy and remains bounded to implementation and verification.",
    "source": {
      "type": "PRIOR_RUN",
      "classification": "SYNTHETIC",
      "reference": "evidence://synthetic-run/failure-zero-budget",
      "sourceVersion": "fixture-v1"
    },
    "sensitivity": "SYNTHETIC",
    "allowedStages": ["implement", "verify"],
    "allowedPersonas": ["synthetic-implementer", "synthetic-validator"],
    "allowedAgents": ["agent.implementation", "agent.verification"],
    "requiredScopes": ["evidence:read"],
    "priority": 88,
    "createdAt": "2026-07-15T12:00:00.000Z",
    "updatedAt": "2026-07-17T00:00:00.000Z",
    "freshnessPolicy": { "mode": "TTL", "ttlSeconds": 604800 },
    "state": "ACTIVE",
    "tags": ["failure", "testing"],
    "citations": [
      {
        "label": "Synthetic prior-run evidence",
        "reference": "evidence://synthetic-run/failure-zero-budget"
      }
    ],
    "contentHash": "4e2097f8411d66a73272c947ab8f4cd9776c2b8819293a4641e91d7d70a0d726"
  },
  {
    "schemaVersion": 1,
    "id": "context.prior.fix.zero-budget-guard",
    "recordType": "PRIOR_FIX",
    "title": "Prior synthetic fix: explicit zero-budget guard",
    "content": "The paired synthetic fix used an explicit zero-budget guard and a dedicated test. It may be selected only when prior-run episodic records are permitted by the bound context policy.",
    "source": {
      "type": "PRIOR_RUN",
      "classification": "SYNTHETIC",
      "reference": "evidence://synthetic-run/fix-zero-budget-guard",
      "sourceVersion": "fixture-v1"
    },
    "sensitivity": "SYNTHETIC",
    "allowedStages": ["implement", "verify"],
    "allowedPersonas": ["synthetic-implementer", "synthetic-validator"],
    "allowedAgents": ["agent.implementation", "agent.verification"],
    "requiredScopes": ["evidence:read"],
    "priority": 87,
    "createdAt": "2026-07-15T12:00:00.000Z",
    "updatedAt": "2026-07-17T00:00:00.000Z",
    "freshnessPolicy": { "mode": "TTL", "ttlSeconds": 604800 },
    "state": "ACTIVE",
    "tags": ["failure", "testing"],
    "contentHash": "a5290c186cefa79f13fcaf6c12a4ae33de839a38c7c4fcf56f40ebc13ffddc33"
  },
  {
    "schemaVersion": 1,
    "id": "context.preference.reduced-motion",
    "recordType": "USER_PREFERENCE",
    "title": "Synthetic preference: reduced motion",
    "content": "The deterministic demo preference requests reduced motion. It contains no prompt history, personal data, account identifier, or external profile information.",
    "source": {
      "type": "USER_CONFIGURATION",
      "classification": "SYNTHETIC",
      "reference": "fixture://preferences/reduced-motion",
      "sourceVersion": "fixture-v1"
    },
    "sensitivity": "SYNTHETIC",
    "allowedStages": ["spec", "plan", "implement"],
    "allowedPersonas": ["synthetic-implementer"],
    "allowedAgents": ["agent.specification", "agent.planning", "agent.implementation"],
    "requiredScopes": ["artifact:read"],
    "priority": 35,
    "createdAt": "2026-07-15T12:00:00.000Z",
    "updatedAt": "2026-07-17T00:00:00.000Z",
    "freshnessPolicy": { "mode": "TTL", "ttlSeconds": 604800 },
    "state": "ACTIVE",
    "tags": ["engineering", "ui"],
    "contentHash": "1705f62e6f027cad279731f87267c5059e8a4827471badb3e231202e597f8084"
  },
  {
    "schemaVersion": 1,
    "id": "context.evidence.validator-only",
    "recordType": "ISSUE_EVIDENCE",
    "title": "Validator-only synthetic evidence note",
    "content": "This synthetic note is restricted to the validator persona and demonstrates that stage compatibility alone does not grant context access.",
    "source": {
      "type": "EVIDENCE",
      "classification": "SYNTHETIC",
      "reference": "evidence://synthetic-run/validator-note",
      "sourceVersion": "fixture-v1"
    },
    "sensitivity": "SYNTHETIC",
    "allowedStages": ["implement", "verify", "review"],
    "allowedPersonas": ["synthetic-validator"],
    "allowedAgents": ["agent.implementation", "agent.verification", "agent.review-assistant"],
    "requiredScopes": ["validation:approve"],
    "priority": 75,
    "createdAt": "2026-07-15T12:00:00.000Z",
    "updatedAt": "2026-07-17T00:00:00.000Z",
    "freshnessPolicy": { "mode": "TTL", "ttlSeconds": 604800 },
    "state": "ACTIVE",
    "tags": ["evidence", "testing"],
    "contentHash": "73df65976771f2e61b059a2c7572e45186322216db5fff773abc649d40d3780f"
  },
  {
    "schemaVersion": 1,
    "id": "context.review.agent-mismatch",
    "recordType": "CUSTOM",
    "title": "Synthetic record reserved for the verification agent",
    "content": "This record deliberately allows the review stage and reviewer persona but not the review agent, demonstrating that agent authorization is independently evaluated.",
    "source": {
      "type": "DOCUMENTATION",
      "classification": "SYNTHETIC",
      "reference": "fixture://context/agent-boundary",
      "sourceVersion": "fixture-v1"
    },
    "sensitivity": "SYNTHETIC",
    "allowedStages": ["review"],
    "allowedPersonas": ["synthetic-code-reviewer"],
    "allowedAgents": ["agent.verification"],
    "requiredScopes": ["artifact:read"],
    "priority": 74,
    "createdAt": "2026-07-15T12:00:00.000Z",
    "updatedAt": "2026-07-17T00:00:00.000Z",